{
  "$schema": "https://json-schema.org/draft/2020-12/schema",
  "$id": "https://milu.studio/schemas/skills/image_generation/output.schema.json",
  "title": "image_generation output envelope",
  "type": "object",
  "additionalProperties": false,
  "required": ["ok", "skill_name", "schema_version", "data", "error", "runtime"],
  "properties": {
    "ok": { "type": "boolean" },
    "skill_name": { "type": "string", "const": "image_generation" },
    "schema_version": { "type": "string", "const": "1.0" },
    "data": {
      "anyOf": [
        { "type": "null" },
        {
          "type": "object",
          "required": [
            "project_id",
            "episode_index",
            "title",
            "language",
            "provider",
            "model",
            "mode",
            "assets",
            "asset_manifest",
            "cost_estimate",
            "review",
            "checkpoint"
          ],
          "properties": {
            "project_id": { "type": "string" },
            "episode_index": { "type": "integer" },
            "title": { "type": "string" },
            "language": { "type": "string" },
            "provider": { "type": "string", "const": "mock" },
            "model": { "type": "string", "const": "none" },
            "mode": { "type": "string" },
            "assets": {
              "type": "array",
              "minItems": 1,
              "items": {
                "type": "object",
                "required": [
                  "asset_id",
                  "request_id",
                  "asset_type",
                  "status",
                  "provider",
                  "model",
                  "prompt",
                  "negative_prompt",
                  "aspect_ratio",
                  "selected",
                  "file_written",
                  "asset_uri",
                  "storage_intent",
                  "metadata"
                ],
                "properties": {
                  "asset_id": { "type": "string" },
                  "request_id": { "type": "string" },
                  "asset_type": { "type": "string" },
                  "shot_id": { "type": ["string", "null"] },
                  "character_id": { "type": ["string", "null"] },
                  "character_ids": { "type": "array", "items": { "type": "string" } },
                  "status": { "type": "string" },
                  "provider": { "type": "string", "const": "mock" },
                  "model": { "type": "string", "const": "none" },
                  "prompt": { "type": "string" },
                  "negative_prompt": { "type": "array", "items": { "type": "string" } },
                  "aspect_ratio": { "type": "string" },
                  "selected": { "type": "boolean" },
                  "file_written": { "type": "boolean", "const": false },
                  "asset_uri": { "type": "string" },
                  "storage_intent": { "type": "object" },
                  "metadata": { "type": "object" }
                }
              }
            },
            "asset_manifest": { "type": "object" },
            "cost_estimate": { "type": "object" },
            "review": { "type": "object" },
            "checkpoint": { "type": "object" }
          }
        }
      ]
    },
    "error": {
      "anyOf": [
        { "type": "null" },
        {
          "type": "object",
          "required": ["code", "message", "details"],
          "properties": {
            "code": { "type": "string" },
            "message": { "type": "string" },
            "details": { "type": "array", "items": { "type": "string" } }
          }
        }
      ]
    },
    "runtime": {
      "type": "object",
      "required": ["duration_ms", "model", "mode", "cost_estimate"],
      "properties": {
        "duration_ms": { "type": "number" },
        "model": { "type": "string" },
        "mode": { "type": "string" },
        "cost_estimate": { "type": "number" }
      }
    }
  }
}

